{
  "contractVersion": "btb-pressure-history.v1",
  "modelRegime": "BTB_RB1_20261018",
  "matchKey": "2026-10-21:3225759:22:00:00",
  "asOf": "2026-10-22T08:15:11.585Z",
  "availability": "AVAILABLE",
  "reason": "AVAILABLE",
  "source": "VERIFIED_RB1_HISTORY",
  "historical": true,
  "coverage": "PERSISTED_VERIFIED_INTERVALS_ONLY",
  "fullMatchCoverageProven": false,
  "samples": [
    {
      "captureId": "8A567574798B1FD1B3B097022BCC88BA",
      "stateId": "8A567574798B1FD1B3B03909215288BA",
      "pressureSequence": 7,
      "policySha": "2BD9B781186351B53E1215B1CDCD245BD073C8CEEFB4C8B9468EFF3E18BE6F62",
      "producerSha": "18714D2689D36E8E0A8AB3AD62437CC46C51741D9832FDD540C018B04B81B150",
      "method": "RB1_APPROVED_BASE_10A",
      "startsAt": "2026-10-21T19:21:13.079Z",
      "endsAt": "2026-10-21T19:22:13.246Z",
      "startsAtExact": "20261021192113.0791590",
      "endsAtExact": "20261021192213.2468150",
      "startMinute": 21,
      "endMinute": 22,
      "phase": "1H",
      "homeScore": 0,
      "awayScore": 0,
      "home": "0",
      "away": "0.9972135195029036863260885549538443",
      "total": "0.9972135195029036863260885549538443",
      "estimated": true,
      "connects": false,
      "components": null
    },
    {
      "captureId": "8A567574798B1FD1B3B0AD43FB81A8BA",
      "stateId": "8A567574798B1FD1B3B0A46A5DEE88BA",
      "pressureSequence": 8,
      "policySha": "2BD9B781186351B53E1215B1CDCD245BD073C8CEEFB4C8B9468EFF3E18BE6F62",
      "producerSha": "18714D2689D36E8E0A8AB3AD62437CC46C51741D9832FDD540C018B04B81B150",
      "method": "RB1_APPROVED_BASE_10A",
      "startsAt": "2026-10-21T19:25:13.195Z",
      "endsAt": "2026-10-21T19:27:12.956Z",
      "startsAtExact": "20261021192513.1956670",
      "endsAtExact": "20261021192712.9565160",
      "startMinute": 25,
      "endMinute": 27,
      "phase": "1H",
      "homeScore": 0,
      "awayScore": 1,
      "home": "0",
      "away": "1.502995357021892855819684444621798",
      "total": "1.502995357021892855819684444621798",
      "estimated": true,
      "connects": false,
      "components": null
    },
    {
      "captureId": "8A567574798B1FD1B3B0D57FC23268BA",
      "stateId": "8A567574798B1FD1B3B0D11A7AED08BA",
      "pressureSequence": 11,
      "policySha": "2BD9B781186351B53E1215B1CDCD245BD073C8CEEFB4C8B9468EFF3E18BE6F62",
      "producerSha": "18714D2689D36E8E0A8AB3AD62437CC46C51741D9832FDD540C018B04B81B150",
      "method": "RB1_APPROVED_BASE_10A",
      "startsAt": "2026-10-21T19:35:12.984Z",
      "endsAt": "2026-10-21T19:36:13.131Z",
      "startsAtExact": "20261021193512.9847230",
      "endsAtExact": "20261021193613.1315820",
      "startMinute": 35,
      "endMinute": 36,
      "phase": "1H",
      "homeScore": 1,
      "awayScore": 1,
      "home": "2.992674979087436635718583409318182",
      "away": "0",
      "total": "2.992674979087436635718583409318182",
      "estimated": true,
      "connects": false,
      "components": null
    },
    {
      "captureId": "8A567574798B1FD1B3B0EBD9D7D488BA",
      "stateId": "8A567574798B1FD1B3B0D11A7AED08BA",
      "pressureSequence": 12,
      "policySha": "2BD9B781186351B53E1215B1CDCD245BD073C8CEEFB4C8B9468EFF3E18BE6F62",
      "producerSha": "18714D2689D36E8E0A8AB3AD62437CC46C51741D9832FDD540C018B04B81B150",
      "method": "RB1_APPROVED_BASE_10A",
      "startsAt": "2026-10-21T19:40:13.111Z",
      "endsAt": "2026-10-21T19:41:13.172Z",
      "startsAtExact": "20261021194013.1113570",
      "endsAtExact": "20261021194113.1720630",
      "startMinute": 40,
      "endMinute": 41,
      "phase": "1H",
      "homeScore": 1,
      "awayScore": 1,
      "home": "0.9989892559704509633969337623170797",
      "away": "0",
      "total": "0.9989892559704509633969337623170797",
      "estimated": true,
      "connects": false,
      "components": null
    },
    {
      "captureId": "8A567574798B1FD1B3B0F4CAAFE1E8BA",
      "stateId": "8A567574798B1FD1B3B0D11A7AED08BA",
      "pressureSequence": 12,
      "policySha": "2BD9B781186351B53E1215B1CDCD245BD073C8CEEFB4C8B9468EFF3E18BE6F62",
      "producerSha": "18714D2689D36E8E0A8AB3AD62437CC46C51741D9832FDD540C018B04B81B150",
      "method": "RB1_APPROVED_BASE_10A",
      "startsAt": "2026-10-21T19:41:13.172Z",
      "endsAt": "2026-10-21T19:43:13.198Z",
      "startsAtExact": "20261021194113.1720630",
      "endsAtExact": "20261021194313.1985960",
      "startMinute": 41,
      "endMinute": 43,
      "phase": "1H",
      "homeScore": 1,
      "awayScore": 1,
      "home": "0",
      "away": "0.7498342054085657876996247154785351",
      "total": "0.7498342054085657876996247154785351",
      "estimated": true,
      "connects": true,
      "components": null
    },
    {
      "captureId": "8A567574798B1FD1B3B0FDBB8CCC68BA",
      "stateId": "8A567574798B1FD1B3B0D11A7AED08BA",
      "pressureSequence": 12,
      "policySha": "2BD9B781186351B53E1215B1CDCD245BD073C8CEEFB4C8B9468EFF3E18BE6F62",
      "producerSha": "18714D2689D36E8E0A8AB3AD62437CC46C51741D9832FDD540C018B04B81B150",
      "method": "RB1_APPROVED_BASE_10A",
      "startsAt": "2026-10-21T19:43:13.198Z",
      "endsAt": "2026-10-21T19:45:12.953Z",
      "startsAtExact": "20261021194313.1985960",
      "endsAtExact": "20261021194512.9533850",
      "startMinute": 43,
      "endMinute": 45,
      "phase": "1H",
      "homeScore": 1,
      "awayScore": 1,
      "home": "0.2505119022839245284796084438844446",
      "away": "0",
      "total": "0.2505119022839245284796084438844446",
      "estimated": true,
      "connects": true,
      "components": null
    },
    {
      "captureId": "8A567574798B1FD1B3B16014EA5FA8BA",
      "stateId": "8A567574798B1FD1B3B152D5115728BA",
      "pressureSequence": 13,
      "policySha": "2BD9B781186351B53E1215B1CDCD245BD073C8CEEFB4C8B9468EFF3E18BE6F62",
      "producerSha": "18714D2689D36E8E0A8AB3AD62437CC46C51741D9832FDD540C018B04B81B150",
      "method": "RB1_APPROVED_BASE_10A",
      "startsAt": "2026-10-21T20:04:13.513Z",
      "endsAt": "2026-10-21T20:07:13.409Z",
      "startsAtExact": "20261021200413.5131680",
      "endsAtExact": "20261021200713.4094530",
      "startMinute": 46,
      "endMinute": 48,
      "phase": "2H",
      "homeScore": 1,
      "awayScore": 1,
      "home": "0",
      "away": "1.167339281075203970999178776815764",
      "total": "1.167339281075203970999178776815764",
      "estimated": true,
      "connects": false,
      "components": null
    },
    {
      "captureId": "8A567574798B1FD1B3B1693308C728BA",
      "stateId": "8A567574798B1FD1B3B152D5115728BA",
      "pressureSequence": 13,
      "policySha": "2BD9B781186351B53E1215B1CDCD245BD073C8CEEFB4C8B9468EFF3E18BE6F62",
      "producerSha": "18714D2689D36E8E0A8AB3AD62437CC46C51741D9832FDD540C018B04B81B150",
      "method": "RB1_APPROVED_BASE_10A",
      "startsAt": "2026-10-21T20:07:13.409Z",
      "endsAt": "2026-10-21T20:09:13.462Z",
      "startsAtExact": "20261021200713.4094530",
      "endsAtExact": "20261021200913.4621450",
      "startMinute": 48,
      "endMinute": 51,
      "phase": "2H",
      "homeScore": 1,
      "awayScore": 1,
      "home": "1.49934163908627721567459728433245",
      "away": "0",
      "total": "1.49934163908627721567459728433245",
      "estimated": true,
      "connects": true,
      "components": null
    },
    {
      "captureId": "8A567574798B1FD1B3B195B9CDF7E8BA",
      "stateId": "8A567574798B1FD1B3B152D5115728BA",
      "pressureSequence": 15,
      "policySha": "2BD9B781186351B53E1215B1CDCD245BD073C8CEEFB4C8B9468EFF3E18BE6F62",
      "producerSha": "18714D2689D36E8E0A8AB3AD62437CC46C51741D9832FDD540C018B04B81B150",
      "method": "RB1_APPROVED_BASE_10A",
      "startsAt": "2026-10-21T20:16:13.534Z",
      "endsAt": "2026-10-21T20:19:13.375Z",
      "startsAtExact": "20261021201613.5345650",
      "endsAtExact": "20261021201913.3757670",
      "startMinute": 57,
      "endMinute": 60,
      "phase": "2H",
      "homeScore": 1,
      "awayScore": 1,
      "home": "0.3336276633649279101237323803029297",
      "away": "0",
      "total": "0.3336276633649279101237323803029297",
      "estimated": true,
      "connects": false,
      "components": null
    },
    {
      "captureId": "8A567574798B1FD1B3B19ED65C1D28BA",
      "stateId": "8A567574798B1FD1B3B19A323595A8BA",
      "pressureSequence": 16,
      "policySha": "2BD9B781186351B53E1215B1CDCD245BD073C8CEEFB4C8B9468EFF3E18BE6F62",
      "producerSha": "18714D2689D36E8E0A8AB3AD62437CC46C51741D9832FDD540C018B04B81B150",
      "method": "RB1_APPROVED_BASE_10A",
      "startsAt": "2026-10-21T20:20:13.523Z",
      "endsAt": "2026-10-21T20:21:13.631Z",
      "startsAtExact": "20261021202013.5231000",
      "endsAtExact": "20261021202113.6318820",
      "startMinute": 61,
      "endMinute": 62,
      "phase": "2H",
      "homeScore": 2,
      "awayScore": 1,
      "home": "0.9981902478077163500002379020090608",
      "away": "0",
      "total": "0.9981902478077163500002379020090608",
      "estimated": true,
      "connects": false,
      "components": null
    },
    {
      "captureId": "8A567574798B1FD1B3B1A7C7E00BE8BA",
      "stateId": "8A567574798B1FD1B3B19A323595A8BA",
      "pressureSequence": 16,
      "policySha": "2BD9B781186351B53E1215B1CDCD245BD073C8CEEFB4C8B9468EFF3E18BE6F62",
      "producerSha": "18714D2689D36E8E0A8AB3AD62437CC46C51741D9832FDD540C018B04B81B150",
      "method": "RB1_APPROVED_BASE_10A",
      "startsAt": "2026-10-21T20:21:13.631Z",
      "endsAt": "2026-10-21T20:23:13.543Z",
      "startsAtExact": "20261021202113.6318820",
      "endsAtExact": "20261021202313.5434400",
      "startMinute": 62,
      "endMinute": 64,
      "phase": "2H",
      "homeScore": 2,
      "awayScore": 1,
      "home": "0.2501843900652179000126076253633532",
      "away": "0",
      "total": "0.2501843900652179000126076253633532",
      "estimated": true,
      "connects": true,
      "components": null
    },
    {